{
 "$schema": "https://json-schema.org/draft/2020-12/schema",
 "$ref": "#/definitions/objs_message",
 "definitions": {
  "blocks": {
   "description": "This is a very loose definition, in the future, we'll populate this with deeper schema in this definition namespace.",
   "items": {
    "additionalProperties": true,
    "properties": {
     "type": {
      "type": "string"
     }
    },
    "required": [
     "type"
    ],
    "type": "object"
   },
   "title": "Block Kit blocks",
   "type": "array"
  },
  "defs_app_id": {
   "pattern": "^A[A-Z0-9]{1,}$",
   "title": "App ID",
   "type": "string"
  },
  "defs_bot_id": {
   "pattern": "^B[A-Z0-9]{8,}$",
   "title": "Bot User ID",
   "type": "string"
  },
  "defs_channel": {
   "pattern": "^[CGD][A-Z0-9]{8,}$",
   "title": "Channel-like conversation ID",
   "type": "string"
  },
  "defs_channel_id": {
   "pattern": "^[C][A-Z0-9]{2,}$",
   "title": "Channel ID",
   "type": "string"
  },
  "defs_comment_id": {
   "pattern": "^Fc[A-Z0-9]{8,}$",
   "title": "File Comment ID",
   "type": "string"
  },
  "defs_dm_id": {
   "pattern": "^[D][A-Z0-9]{8,}$",
   "title": "Direct Message Channel ID",
   "type": "string"
  },
  "defs_file_id": {
   "pattern": "^[F][A-Z0-9]{8,}$",
   "title": "File ID",
   "type": "string"
  },
  "defs_group_id": {
   "pattern": "^[G][A-Z0-9]{8,}$",
   "title": "Private Channel ID",
   "type": "string"
  },
  "defs_pinned_info": {
   "additionalProperties": false,
   "title": "Info for a pinned item",
   "type": "object"
  },
  "defs_team": {
   "pattern": "^[T][A-Z0-9]{2,}$",
   "title": "Team ID",
   "type": "string"
  },
  "defs_ts": {
   "pattern": "^\\d{10}\\.\\d{6}$",
   "title": "Timestamp in format 0123456789.012345",
   "type": "string"
  },
  "defs_user_id": {
   "pattern": "^[UW][A-Z0-9]{2,}$",
   "title": "User ID",
   "type": "string"
  },
  "defs_workspace_id": {
   "pattern": "^[TE][A-Z0-9]{8,}$",
   "title": "Team or Enterprise ID",
   "type": "string"
  },
  "objs_bot_profile": {
   "additionalProperties": false,
   "properties": {
    "app_id": {
     "$ref": "#/definitions/defs_app_id"
    },
    "deleted": {
     "type": "boolean"
    },
    "icons": {
     "additionalProperties": false,
     "properties": {
      "image_36": {
       "format": "uri",
       "type": "string"
      },
      "image_48": {
       "format": "uri",
       "type": "string"
      },
      "image_72": {
       "format": "uri",
       "type": "string"
      }
     },
     "required": [
      "image_36",
      "image_48",
      "image_72"
     ],
     "type": "object"
    },
    "id": {
     "$ref": "#/definitions/defs_bot_id"
    },
    "name": {
     "type": "string"
    },
    "team_id": {
     "$ref": "#/definitions/defs_team"
    },
    "updated": {
     "type": "integer"
    }
   },
   "required": [
    "id",
    "deleted",
    "name",
    "updated",
    "app_id",
    "icons",
    "team_id"
   ],
   "title": "Bot Profile Object",
   "type": "object"
  },
  "objs_comment": {
   "additionalProperties": false,
   "properties": {
    "comment": {
     "type": "string"
    },
    "created": {
     "type": "integer"
    },
    "id": {
     "$ref": "#/definitions/defs_comment_id"
    },
    "is_intro": {
     "type": "boolean"
    },
    "is_starred": {
     "type": "boolean"
    },
    "num_stars": {
     "type": "integer"
    },
    "pinned_info": {
     "$ref": "#/definitions/defs_pinned_info"
    },
    "pinned_to": {
     "items": {
      "$ref": "#/definitions/defs_channel"
     },
     "type": "array"
    },
    "reactions": {
     "items": {
      "$ref": "#/definitions/objs_reaction"
     },
     "type": "array"
    },
    "timestamp": {
     "type": "integer"
    },
    "user": {
     "$ref": "#/definitions/defs_user_id"
    }
   },
   "required": [
    "id",
    "created",
    "timestamp",
    "user",
    "is_intro",
    "comment"
   ],
   "title": "File Comment Object",
   "type": "object"
  },
  "objs_file": {
   "additionalProperties": false,
   "properties": {
    "channels": {
     "items": {
      "$ref": "#/definitions/defs_channel_id"
     },
     "type": "array",
     "uniqueItems": true
    },
    "comments_count": {
     "type": "integer"
    },
    "created": {
     "type": "integer"
    },
    "date_delete": {
     "type": "integer"
    },
    "display_as_bot": {
     "type": "boolean"
    },
    "editable": {
     "type": "boolean"
    },
    "editor": {
     "$ref": "#/definitions/defs_user_id"
    },
    "external_id": {
     "type": "string"
    },
    "external_type": {
     "type": "string"
    },
    "external_url": {
     "format": "uri",
     "type": "string"
    },
    "filetype": {
     "type": "string"
    },
    "groups": {
     "items": {
      "$ref": "#/definitions/defs_group_id"
     },
     "type": "array",
     "uniqueItems": true
    },
    "has_rich_preview": {
     "type": "boolean"
    },
    "id": {
     "$ref": "#/definitions/defs_file_id"
    },
    "image_exif_rotation": {
     "type": "integer"
    },
    "ims": {
     "items": {
      "$ref": "#/definitions/defs_dm_id"
     },
     "type": "array",
     "uniqueItems": true
    },
    "is_external": {
     "type": "boolean"
    },
    "is_public": {
     "type": "boolean"
    },
    "is_starred": {
     "type": "boolean"
    },
    "is_tombstoned": {
     "type": "boolean"
    },
    "last_editor": {
     "$ref": "#/definitions/defs_user_id"
    },
    "mimetype": {
     "type": "string"
    },
    "mode": {
     "type": "string"
    },
    "name": {
     "type": "string"
    },
    "non_owner_editable": {
     "type": "boolean"
    },
    "num_stars": {
     "type": "integer"
    },
    "original_h": {
     "type": "integer"
    },
    "original_w": {
     "type": "integer"
    },
    "permalink": {
     "format": "uri",
     "type": "string"
    },
    "permalink_public": {
     "format": "uri",
     "type": "string"
    },
    "pinned_info": {
     "$ref": "#/definitions/defs_pinned_info"
    },
    "pinned_to": {
     "items": {
      "$ref": "#/definitions/defs_channel"
     },
     "type": "array"
    },
    "pretty_type": {
     "type": "string"
    },
    "preview": {
     "type": "string"
    },
    "public_url_shared": {
     "type": "boolean"
    },
    "reactions": {
     "items": {
      "$ref": "#/definitions/objs_reaction"
     },
     "type": "array"
    },
    "shares": {
     "additionalProperties": false,
     "properties": {
      "private": {
       "additionalProperties": false
      },
      "public": {
       "additionalProperties": false
      }
     },
     "type": "object"
    },
    "size": {
     "type": "integer"
    },
    "source_team": {
     "$ref": "#/definitions/defs_team"
    },
    "state": {
     "type": "string"
    },
    "thumb_1024": {
     "format": "uri",
     "type": "string"
    },
    "thumb_1024_h": {
     "type": "integer"
    },
    "thumb_1024_w": {
     "type": "integer"
    },
    "thumb_160": {
     "format": "uri",
     "type": "string"
    },
    "thumb_360": {
     "format": "uri",
     "type": "string"
    },
    "thumb_360_h": {
     "type": "integer"
    },
    "thumb_360_w": {
     "type": "integer"
    },
    "thumb_480": {
     "format": "uri",
     "type": "string"
    },
    "thumb_480_h": {
     "type": "integer"
    },
    "thumb_480_w": {
     "type": "integer"
    },
    "thumb_64": {
     "format": "uri",
     "type": "string"
    },
    "thumb_720": {
     "format": "uri",
     "type": "string"
    },
    "thumb_720_h": {
     "type": "integer"
    },
    "thumb_720_w": {
     "type": "integer"
    },
    "thumb_80": {
     "format": "uri",
     "type": "string"
    },
    "thumb_800": {
     "format": "uri",
     "type": "string"
    },
    "thumb_800_h": {
     "type": "integer"
    },
    "thumb_800_w": {
     "type": "integer"
    },
    "thumb_960": {
     "format": "uri",
     "type": "string"
    },
    "thumb_960_h": {
     "type": "integer"
    },
    "thumb_960_w": {
     "type": "integer"
    },
    "thumb_tiny": {
     "type": "string"
    },
    "timestamp": {
     "type": "integer"
    },
    "title": {
     "type": "string"
    },
    "updated": {
     "type": "integer"
    },
    "url_private": {
     "format": "uri",
     "type": "string"
    },
    "url_private_download": {
     "format": "uri",
     "type": "string"
    },
    "user": {
     "type": "string"
    },
    "user_team": {
     "$ref": "#/definitions/defs_team"
    },
    "username": {
     "type": "string"
    }
   },
   "title": "file object",
   "type": "object"
  },
  "objs_message": {
   "additionalProperties": false,
   "properties": {
    "attachments": {
     "items": {
      "additionalProperties": false,
      "properties": {
       "fallback": {
        "type": "string"
       },
       "id": {
        "type": "integer"
       },
       "image_bytes": {
        "type": "integer"
       },
       "image_height": {
        "type": "integer"
       },
       "image_url": {
        "type": "string"
       },
       "image_width": {
        "type": "integer"
       }
      },
      "required": [
       "id"
      ],
      "type": "object"
     },
     "minItems": 1,
     "type": "array",
     "uniqueItems": true
    },
    "blocks": {
     "$ref": "#/definitions/blocks"
    },
    "bot_id": {
     "items": [
      {
       "$ref": "#/definitions/defs_bot_id"
      },
      {
       "title": "Nil bot_id set when display_as_bot is false",
       "type": "null"
      }
     ]
    },
    "bot_profile": {
     "$ref": "#/definitions/objs_bot_profile"
    },
    "client_msg_id": {
     "type": "string"
    },
    "comment": {
     "$ref": "#/definitions/objs_comment"
    },
    "display_as_bot": {
     "type": "boolean"
    },
    "file": {
     "$ref": "#/definitions/objs_file"
    },
    "files": {
     "items": {
      "$ref": "#/definitions/objs_file"
     },
     "minItems": 1,
     "type": "array",
     "uniqueItems": true
    },
    "icons": {
     "additionalProperties": false,
     "properties": {
      "emoji": {
       "type": "string"
      },
      "image_64": {
       "format": "uri",
       "type": "string"
      }
     },
     "type": "object"
    },
    "inviter": {
     "$ref": "#/definitions/defs_user_id"
    },
    "is_delayed_message": {
     "type": "boolean"
    },
    "is_intro": {
     "type": "boolean"
    },
    "is_starred": {
     "type": "boolean"
    },
    "last_read": {
     "$ref": "#/definitions/defs_ts"
    },
    "latest_reply": {
     "$ref": "#/definitions/defs_ts"
    },
    "name": {
     "type": "string"
    },
    "old_name": {
     "type": "string"
    },
    "parent_user_id": {
     "$ref": "#/definitions/defs_user_id"
    },
    "permalink": {
     "format": "uri",
     "type": "string"
    },
    "pinned_to": {
     "items": {
      "$ref": "#/definitions/defs_channel"
     },
     "type": "array"
    },
    "purpose": {
     "type": "string"
    },
    "reactions": {
     "items": {
      "$ref": "#/definitions/objs_reaction"
     },
     "type": "array"
    },
    "reply_count": {
     "type": "integer"
    },
    "reply_users": {
     "items": {
      "$ref": "#/definitions/defs_user_id"
     },
     "minItems": 1,
     "type": "array",
     "uniqueItems": true
    },
    "reply_users_count": {
     "type": "integer"
    },
    "source_team": {
     "$ref": "#/definitions/defs_workspace_id"
    },
    "subscribed": {
     "type": "boolean"
    },
    "subtype": {
     "type": "string"
    },
    "team": {
     "$ref": "#/definitions/defs_workspace_id"
    },
    "text": {
     "type": "string"
    },
    "thread_ts": {
     "$ref": "#/definitions/defs_ts"
    },
    "topic": {
     "type": "string"
    },
    "ts": {
     "$ref": "#/definitions/defs_ts"
    },
    "type": {
     "type": "string"
    },
    "unread_count": {
     "type": "integer"
    },
    "upload": {
     "type": "boolean"
    },
    "user": {
     "$ref": "#/definitions/defs_user_id"
    },
    "user_profile": {
     "$ref": "#/definitions/objs_user_profile_short"
    },
    "user_team": {
     "$ref": "#/definitions/defs_workspace_id"
    },
    "username": {
     "type": "string"
    }
   },
   "required": [
    "text",
    "type",
    "ts"
   ],
   "title": "Message object",
   "type": "object"
  },
  "objs_reaction": {
   "additionalProperties": true,
   "properties": {
    "count": {
     "type": "integer"
    },
    "name": {
     "type": "string"
    },
    "users": {
     "items": {
      "$ref": "#/definitions/defs_user_id"
     },
     "type": "array"
    }
   },
   "required": [
    "name",
    "users",
    "count"
   ],
   "title": "Reaction object",
   "type": "object"
  },
  "objs_user_profile_short": {
   "additionalProperties": false,
   "properties": {
    "avatar_hash": {
     "type": "string"
    },
    "display_name": {
     "type": "string"
    },
    "display_name_normalized": {
     "type": "string"
    },
    "first_name": {
     "type": [
      "string",
      "null"
     ]
    },
    "image_72": {
     "format": "uri",
     "type": "string"
    },
    "is_restricted": {
     "type": "boolean"
    },
    "is_ultra_restricted": {
     "type": "boolean"
    },
    "name": {
     "type": "string"
    },
    "real_name": {
     "type": "string"
    },
    "real_name_normalized": {
     "type": "string"
    },
    "team": {
     "$ref": "#/definitions/defs_workspace_id"
    }
   },
   "required": [
    "avatar_hash",
    "image_72",
    "first_name",
    "real_name",
    "display_name",
    "team",
    "name",
    "is_restricted",
    "is_ultra_restricted"
   ],
   "type": "object"
  }
 },
 "x-source": "slackapi/slack-api-specs web-api/slack_web_openapi_v2.json definitions.objs_message"
}
