[
  {
    "type": "message",
    "subtype": "channel_join",
    "user": "U03MU4G0DPE",
    "text": "<@U03MU4G0DPE> has joined the channel",
    "ts": "1791902100.000006",
    "team": "T0LARKSPUR"
  },
  {
    "type": "message",
    "subtype": "bot_message",
    "text": "Incident #8812 *p90 latency high on payments-gw* on Payments - Prod: Triggered, assigned to Tom Beckett",
    "ts": "1791902104.000001",
    "username": "PagerDuty",
    "bot_id": "B0KZ207TOM1"
  },
  {
    "type": "message",
    "subtype": "bot_message",
    "text": "Incident #8814 *checkout-api error rate > 5%* on Checkout - Prod: Acknowledged by Alice Nguyen",
    "ts": "1791902105.000002",
    "username": "PagerDuty",
    "bot_id": "B0KZ207TOM1"
  },
  {
    "type": "message",
    "user": "U03MU4G0DPE",
    "text": "IC here. checkout payments failing / slow since ~14:30, 504s on submit. INC0048811. <@U0OUMNOBHU9> <@U01B0NXMOC4> <@U01GG60ZVQK> pls join",
    "ts": "1791902120.000002",
    "team": "T0LARKSPUR",
    "client_msg_id": "87748d1b-49a5-c3b3-e9b3-08182e847219"
  },
  {
    "type": "message",
    "user": "U0OUMNOBHU9",
    "text": "joining. pulling up the checkout dashboards",
    "ts": "1791902141.000001",
    "team": "T0LARKSPUR",
    "client_msg_id": "8e962803-dc93-fe21-8c02-21b7392188f4"
  },
  {
    "type": "message",
    "user": "U01B0NXMOC4",
    "text": "we deployed checkout-api 2.14.3 at 14:28, that's gotta be it. <@U03MU4G0DPE> can we roll back?",
    "ts": "1791902160.000004",
    "team": "T0LARKSPUR",
    "client_msg_id": "9d825290-905a-6de4-13bb-ee57bb749f5e"
  },
  {
    "type": "message",
    "user": "U03MU4G0DPE",
    "text": "yes, roll it back. <@U01B0NXMOC4> go",
    "ts": "1791902190.000001",
    "team": "T0LARKSPUR",
    "client_msg_id": "403392f9-989c-c23a-848d-85f99e15dfe3"
  },
  {
    "type": "message",
    "user": "U01B0NXMOC4",
    "text": "on it, rollback job queued. pods look healthy fwiw, nothing crashlooping",
    "ts": "1791902208.000001",
    "team": "T0LARKSPUR",
    "client_msg_id": "4e5d4162-98a7-97c5-b996-e575217bfa6d"
  },
  {
    "type": "message",
    "subtype": "bot_message",
    "text": "Incident #8815 *[Synthetics] checkout flow* merged into #8814 by Alice Nguyen",
    "ts": "1791902221.000006",
    "username": "PagerDuty",
    "bot_id": "B0KZ207TOM1"
  },
  {
    "type": "message",
    "user": "U0W2EYK5S75",
    "text": "what do we put on the status page? do we say anything yet",
    "ts": "1791902228.000002",
    "team": "T0LARKSPUR",
    "client_msg_id": "2cdb6b4e-de1c-145f-7144-70c76aa11576"
  },
  {
    "type": "message",
    "user": "U0OUMNOBHU9",
    "text": "is it redis again? the runbook says check redis",
    "ts": "1791902250.000003",
    "team": "T0LARKSPUR",
    "client_msg_id": "3895bd05-0b12-8adc-d585-551309cbd471"
  },
  {
    "type": "message",
    "user": "U03MU4G0DPE",
    "text": "that runbook is ancient, sessions moved to the cluster last year",
    "ts": "1791902270.000002",
    "team": "T0LARKSPUR",
    "client_msg_id": "8cd1528b-4188-d1b9-46af-aba069d3601a"
  },
  {
    "type": "message",
    "user": "U01GG60ZVQK",
    "text": "db is at 197 of 200 usable, mostly pgw_app, plus 40 from recon_app",
    "ts": "1791902280.000006",
    "team": "T0LARKSPUR",
    "client_msg_id": "54ae6c1d-35ee-ccd0-1193-5b365f0d8415",
    "thread_ts": "1791902280.000006",
    "reply_count": 2,
    "reply_users_count": 1,
    "latest_reply": "1791902832.000005",
    "reply_users": [
      "U01GG60ZVQK"
    ]
  },
  {
    "type": "message",
    "user": "U03MU4G0DPE",
    "text": "hold the status page for ten mins. one line 'investigating checkout errors' when we post",
    "ts": "1791902310.000003",
    "team": "T0LARKSPUR",
    "client_msg_id": "02303241-36c2-24c8-ba6d-70fcb1c449d7",
    "reactions": [
      {
        "name": "+1",
        "count": 2,
        "users": [
          "U01B0NXMOC4",
          "U0OUMNOBHU9"
        ]
      }
    ]
  },
  {
    "type": "message",
    "user": "U01B0NXMOC4",
    "text": "who's IC here? sorry, lost track",
    "ts": "1791902350.000004",
    "team": "T0LARKSPUR",
    "client_msg_id": "54978cc9-dfff-27bb-d7f6-582de7bb041b"
  },
  {
    "type": "message",
    "user": "U0OUMNOBHU9",
    "text": "<@U01B0NXMOC4> alice, she's IC. top of the channel",
    "ts": "1791902380.000003",
    "team": "T0LARKSPUR",
    "client_msg_id": "e0c4ae42-d698-ff8b-8fe0-d71c00705f9b"
  },
  {
    "type": "message",
    "user": "U0W2EYK5S75",
    "text": "marketing site synthetic just went red. checking my side, prob separate",
    "ts": "1791902420.000004",
    "team": "T0LARKSPUR",
    "client_msg_id": "338d1c10-1a40-0e7c-2697-efa9d58d43ca"
  },
  {
    "type": "message",
    "user": "U0W2EYK5S75",
    "text": "is this a network thing? marketing site is down too",
    "ts": "1791902460.000002",
    "team": "T0LARKSPUR",
    "client_msg_id": "1c9d0de2-2e4b-1a01-accc-bf061a3f04d6"
  },
  {
    "type": "message",
    "user": "U01GG60ZVQK",
    "text": "still looking",
    "ts": "1791902540.000002",
    "team": "T0LARKSPUR",
    "client_msg_id": "4ed34796-845c-2153-050a-b809a1d0aed5",
    "thread_ts": "1791902280.000006",
    "parent_user_id": "U01GG60ZVQK"
  },
  {
    "type": "message",
    "subtype": "bot_message",
    "text": "Incident #8812 escalated to Priya Raman (no acknowledgement after 10 minutes)",
    "ts": "1791902547.000005",
    "username": "PagerDuty",
    "bot_id": "B0KZ207TOM1"
  },
  {
    "type": "message",
    "user": "U0OUMNOBHU9",
    "text": "first on-call didn't pick up so it went to <@U0XEFKXZ4W1>. good, she's solid",
    "ts": "1791902560.000006",
    "team": "T0LARKSPUR",
    "client_msg_id": "e683f553-4582-1ee5-dcd5-f03f7dd6593f"
  },
  {
    "type": "message",
    "user": "U01B0NXMOC4",
    "text": "checkout-api is back on the old version, watching the error graph",
    "ts": "1791902575.000001",
    "team": "T0LARKSPUR",
    "client_msg_id": "87bb78bd-db7f-ccc8-1926-df22d95bbded"
  },
  {
    "type": "message",
    "user": "U03MU4G0DPE",
    "text": "rollback done, still seeing 504s",
    "ts": "1791902590.000004",
    "team": "T0LARKSPUR",
    "client_msg_id": "43e88a91-f148-b877-6190-6a03e4ab071b"
  },
  {
    "type": "message",
    "user": "U0OUMNOBHU9",
    "text": "this one has the checkout breakdown https://app.datadoghq.com/dashboard/abc-123-xyz",
    "ts": "1791902630.000005",
    "team": "T0LARKSPUR",
    "client_msg_id": "eb04ad61-3582-5a17-b71e-d58137bff706",
    "thread_ts": "1791902630.000005",
    "reply_count": 1,
    "reply_users_count": 1,
    "latest_reply": "1791902725.000005",
    "reply_users": [
      "U01B0NXMOC4"
    ]
  },
  {
    "type": "message",
    "user": "U0XEFKXZ4W1",
    "text": "here, catching up. tom's not answering",
    "ts": "1791902650.000006",
    "team": "T0LARKSPUR",
    "client_msg_id": "b83bc05d-9c38-ce65-a292-36feb2cb78d8"
  },
  {
    "type": "message",
    "subtype": "bot_message",
    "text": "Incident #8812 acknowledged by Priya Raman",
    "ts": "1791902651.000002",
    "username": "PagerDuty",
    "bot_id": "B0KZ207TOM1"
  },
  {
    "type": "message",
    "user": "U0XEFKXZ4W1",
    "text": "paged at 10:42 my time, on my laptop now. reading logs",
    "ts": "1791902680.000002",
    "team": "T0LARKSPUR",
    "client_msg_id": "764cefa9-e802-7727-e8f9-8251fa754ca7"
  },
  {
    "type": "message",
    "user": "U0OUMNOBHU9",
    "text": "pay-03 dropped out of the F5 pool. hardware?",
    "ts": "1791902700.000005",
    "team": "T0LARKSPUR",
    "client_msg_id": "a139735b-8cb5-ad14-1521-55f5efc248e0",
    "thread_ts": "1791902700.000005",
    "reply_count": 1,
    "reply_users_count": 1,
    "latest_reply": "1791902780.000003",
    "reply_users": [
      "U01B0NXMOC4"
    ]
  },
  {
    "type": "message",
    "user": "U01B0NXMOC4",
    "text": "404 for me. <@U0OUMNOBHU9> is that dashboard private or dead?",
    "ts": "1791902725.000005",
    "team": "T0LARKSPUR",
    "client_msg_id": "60830a23-9a8d-9461-2f1f-e98fa0838203",
    "thread_ts": "1791902630.000005",
    "parent_user_id": "U0OUMNOBHU9"
  },
  {
    "type": "message",
    "user": "U0OUMNOBHU9",
    "text": "solarwinds is also firing on pay-03, so it's not only the f5 view",
    "ts": "1791902740.000004",
    "team": "T0LARKSPUR",
    "client_msg_id": "ee0774cb-c647-81fa-1c65-5e4073349b9f",
    "reactions": [
      {
        "name": "eyes",
        "count": 2,
        "users": [
          "U03MU4G0DPE",
          "U01B0NXMOC4"
        ]
      }
    ]
  },
  {
    "type": "message",
    "user": "U0W2EYK5S75",
    "text": "PayCore status page is all green btw",
    "ts": "1791902760.000004",
    "team": "T0LARKSPUR",
    "client_msg_id": "44587e0a-ec5f-3031-2edc-e255c95c0443"
  },
  {
    "type": "message",
    "user": "U01B0NXMOC4",
    "text": "can we just drain it and see if things change?",
    "ts": "1791902780.000003",
    "team": "T0LARKSPUR",
    "client_msg_id": "3910f2a7-1559-1c0c-4438-fafd3be9597c",
    "thread_ts": "1791902700.000005",
    "parent_user_id": "U0OUMNOBHU9"
  },
  {
    "type": "message",
    "user": "U01GG60ZVQK",